{
  "schema_version": "sourceos.event.v0.1",
  "event_id": "evt_shell_launch_20260504_192158",
  "event_class": "process.exec",
  "lane": "process_lifecycle",
  "severity": "info",
  "outcome": "allowed",
  "created_at": "2026-05-04T19:21:58.369000-04:00",
  "observed_at_monotonic_ns": 1635332928505,
  "host": {
    "host_id": "host_local_pseudonym",
    "platform": "sourceos-darwin-compatible",
    "kernel": "darwin-family",
    "privacy_zone": "user_private"
  },
  "actor": {
    "actor_id": "actor_local_interactive_shell",
    "actor_type": "process",
    "display_name": "package-managed shell",
    "uid": "user:501",
    "session_id": "session_local_console"
  },
  "causality": {
    "parent_event_id": null,
    "root_event_id": "evt_shell_launch_20260504_192158",
    "span_id": "span_shell_launch",
    "trace_id": "trace_shell_launch_20260504_192158"
  },
  "subject": {
    "type": "process",
    "id": "proc_package_managed_shell",
    "display": "Homebrew-like package-managed arm64 shell"
  },
  "trust": {
    "mode": "local_first",
    "signature_state": "valid",
    "package_origin": "package_manager",
    "content_hash": "sha256:0000000000000000000000000000000000000000000000000000000000000000",
    "attestation_state": "verified",
    "network_lookup": "not_attempted",
    "degradation_reason": null
  },
  "privacy": {
    "tier": "user_private",
    "redaction_policy": "preserve_causality",
    "secret_fields": ["raw_command_args", "exact_executable_path"]
  },
  "evidence": [
    {
      "evidence_id": "ev_process_monitor_shell_launch",
      "source": "process-monitor",
      "raw_ref": "rawlog:console-export:19:21:58.369",
      "summary": "Package-managed shell process launched and read normal user preference and identity context."
    },
    {
      "evidence_id": "ev_package_db_shell",
      "source": "package-db",
      "raw_ref": null,
      "summary": "Executable classified as package-managed rather than hidden, user-local, or unknown."
    }
  ],
  "operator_narrative": {
    "summary": "Package-managed shell launched and exited cleanly.",
    "risk": "low",
    "why": "The launch matched a local interactive shell pattern and no persistence, privilege escalation, unknown binary, or network exfiltration was observed.",
    "next_action": "No action required unless this shell launch was unexpected.",
    "drilldown_refs": ["ev_process_monitor_shell_launch", "ev_package_db_shell"]
  },
  "sync": {
    "replication_policy": "local_only",
    "retention_class": "standard",
    "exportable": false
  }
}
